{
  "schemaVersion": "correlation-public-replay-v1",
  "correlationId": "corr-demonstration-static",
  "capability": "architecture-scenario-classification-v1",
  "terminalState": "Completed",
  "steps": [
    {
      "sequence": 1,
      "event": "CorrelationCreated",
      "occurredAt": "2026-10-24T10:00:00.000Z"
    },
    {
      "sequence": 2,
      "event": "ProviderCandidateValidated",
      "occurredAt": "2026-10-24T10:00:02.000Z"
    },
    {
      "sequence": 3,
      "event": "CorrelationCompleted",
      "occurredAt": "2026-10-24T10:00:03.000Z"
    },
    {
      "sequence": 4,
      "event": "ExactActiveStateDeleted",
      "occurredAt": "2026-10-24T10:05:00.000Z"
    }
  ],
  "limitations": [
    "This is a reviewed static replay fixture, not a live operational record.",
    "Provider-generated output is candidate analysis and not accepted architectural truth.",
    "Timestamps and identifiers are synthetic public demonstration data."
  ],
  "classification": "PublicTransformed"
}
